{
  "manifest_version": "generator-dataset-input-v1",
  "dataset_type": "observation",
  "dataset_id": "gen-data-S01-L01",
  "dataset_version": "window-20260828T130000Z-map-d545f01d",
  "schema_version": "canonical-observation-v1",
  "created_at": "2026-08-28T14:00:00Z",
  "files": [
    {
      "role": "observations",
      "path": "observations.jsonl",
      "media_type": "application/x-ndjson",
      "sha256": "ac5341e76c0c163faab2ac44f27566a811657554d64dee22d6b44f7f423a06a5",
      "size_bytes": 326
    }
  ],
  "auxiliary_files": [
    {
      "role": "provenance",
      "path": "provenance.jsonl",
      "media_type": "application/x-ndjson",
      "sha256": "31b3f87e333e52acb751c5150acbe39bf4881281bd8f7f5b88e6366de5efe441",
      "size_bytes": 520
    },
    {
      "role": "rejected",
      "path": "rejected.jsonl",
      "media_type": "application/x-ndjson",
      "sha256": "e3b0c44298fc1c149afbf4c8996fb92427ae41e4649b934ca495991b7852b855",
      "size_bytes": 0
    }
  ]
}