{
  "manifest_version": "generator-dataset-input-v1",
  "dataset_type": "observation",
  "dataset_id": "example-observation",
  "dataset_version": "v1.0",
  "schema_version": "canonical-observation-v1",
  "created_at": "2026-08-24T00:00:00Z",
  "files": [
    {
      "role": "observations",
      "path": "observations.csv",
      "media_type": "text/csv",
      "sha256": "f1dc3ce7d93880d3aede4729f71c560f19449619ece756c2760809f899ff8a0f",
      "size_bytes": 126
    }
  ]
}