{
  "manifest_version": "generator-dataset-input-v1",
  "dataset_type": "observation",
  "dataset_id": "gen-data-observations",
  "dataset_version": "v1",
  "schema_version": "canonical-observation-v1",
  "created_at": "2026-08-27T01:05:00Z",
  "files": [
    {
      "role": "observations",
      "path": "observations.jsonl",
      "media_type": "application/x-ndjson",
      "sha256": "a7f85d51ef1d6d3a8393202cb0d6c167632fd61377bc321f3a86e5d74a61ac5a",
      "size_bytes": 202
    }
  ],
  "auxiliary_files": [
    {
      "role": "provenance",
      "path": "provenance.jsonl",
      "media_type": "application/x-ndjson",
      "sha256": "8a29c6663e65e42372144f482a240f309807cea787ff83120a22f905b9990306",
      "size_bytes": 1694
    },
    {
      "role": "rejected",
      "path": "rejected.jsonl",
      "media_type": "application/x-ndjson",
      "sha256": "01ba4719c80b6fe911b091a7c05124b64eeece964e09c058ef8f9805daca546b",
      "size_bytes": 1
    }
  ]
}
