{
  "manifest_version": "generator-dataset-input-v1",
  "dataset_type": "observation",
  "dataset_id": "golden-observation-v1",
  "dataset_version": "v1.0",
  "schema_version": "canonical-observation-v1",
  "created_at": "2026-08-24T00:00:00Z",
  "files": [
    {
      "role": "observations",
      "path": "observations.csv",
      "media_type": "text/csv",
      "sha256": "2f67bdb37017e0661d08a306c9686bfb231ee68c7e5277a3ffc2c2a5952c4462",
      "size_bytes": 838
    }
  ]
}