{
  "$schema": "https://ontology-dashboard.local/schemas/generator-dataset-input-manifest.schema.json",
  "manifest_version": "generator-dataset-input-v1",
  "dataset_type": "observation",
  "dataset_id": "gen-data-S01-L01",
  "dataset_version": "window-20260828T130000Z-map-a1b2c3d4",
  "schema_version": "canonical-observation-v1",
  "created_at": "2026-08-28T14:00:05Z",
  "files": [
    {
      "role": "observations",
      "path": "observations.jsonl",
      "media_type": "application/x-ndjson",
      "sha256": "e3b0c44298fc1c149afbf4c8996fb92427ae41e4649b934ca495991b7852b855",
      "size_bytes": 1024
    }
  ],
  "auxiliary_files": [
    {
      "role": "provenance",
      "path": "provenance.jsonl",
      "media_type": "application/x-ndjson",
      "sha256": "e3b0c44298fc1c149afbf4c8996fb92427ae41e4649b934ca495991b7852b855",
      "size_bytes": 2048
    },
    {
      "role": "rejected",
      "path": "rejected.jsonl",
      "media_type": "application/x-ndjson",
      "sha256": "e3b0c44298fc1c149afbf4c8996fb92427ae41e4649b934ca495991b7852b855",
      "size_bytes": 0
    }
  ],
  "extraction_context": {
    "source_format": "gen_data_sensor_stream",
    "source_identity": "9f86d081884c7d659a2feaa0c55ad015a3bf4f1b2b0b822cd15d6c15b0f00a08",
    "source_uri": "sensor/facS01/lineL01/sensor_stream.jsonl",
    "site_id": "S01",
    "cell_id": "L01",
    "window_start": "2026-08-28T13:00:00Z",
    "window_end": "2026-08-28T14:00:00Z",
    "source_start_offset": 12000,
    "source_end_offset": 15000,
    "mapping_id": "gen-data-sensor-stream-canonical",
    "mapping_version": "v1",
    "mapping_sha256": "f1ab2ef5af3a015beba4eb7680254e6740a5e7f3c906a6aa16e45c8dba280df1",
    "source_fragment_manifest_sha256": [
      "e3b0c44298fc1c149afbf4c8996fb92427ae41e4649b934ca495991b7852b855"
    ]
  }
}
